{
  "address_ranges": [
    {
      "alignment_bytes": 256,
      "backing_allocation_id": "tinyllama.layer0.down_projection.input.capture0",
      "capture_allocation_id": "tinyllama.layer0.down_projection.input.capture0",
      "capture_epoch": 0,
      "layout": "strided",
      "shape": [
        1,
        16,
        5632
      ],
      "size_bytes": 180224,
      "tensor_id": "tinyllama.layer0.down_projection.input",
      "tensor_offset_bytes": 0,
      "trace_base": 47380156928,
      "view_offset_bytes": 0
    },
    {
      "alignment_bytes": 256,
      "backing_allocation_id": "tinyllama.layer0.down_projection.weight.capture0",
      "capture_allocation_id": "tinyllama.layer0.down_projection.weight.capture0",
      "capture_epoch": 0,
      "layout": "strided",
      "shape": [
        2048,
        5632
      ],
      "size_bytes": 23068672,
      "tensor_id": "tinyllama.layer0.down_projection.weight",
      "tensor_offset_bytes": 0,
      "trace_base": 47355789312,
      "view_offset_bytes": 0
    },
    {
      "alignment_bytes": 256,
      "backing_allocation_id": "tinyllama.layer0.down_projection.output.capture0",
      "capture_allocation_id": "tinyllama.layer0.down_projection.output.capture0",
      "capture_epoch": 0,
      "layout": "strided",
      "shape": [
        1,
        16,
        2048
      ],
      "size_bytes": 65536,
      "tensor_id": "tinyllama.layer0.down_projection.output",
      "tensor_offset_bytes": 0,
      "trace_base": 47380091392,
      "view_offset_bytes": 0
    }
  ],
  "capture": {
    "dtype": "fp16",
    "model": "TinyLlama/TinyLlama-1.1B-Chat-v1.0",
    "model_revision": "fe8a4ea1ffedaf415f4da2f062534de366a451e6",
    "operator": "down_projection",
    "phase": "prefill",
    "scope": "one_shape_locked_operator_not_end_to_end",
    "shape": {
      "batch_size": 1,
      "context_length": 16,
      "kv_length": 16,
      "q_len": 16
    },
    "source": "P15 shape-locked operator capture",
    "tool": "NVBit",
    "version": "1.8"
  },
  "compilation": {
    "cuda_runtime": "12.1",
    "implementation": "transformers.LlamaMLP.down_proj",
    "pytorch": "2.3.0+cu121",
    "target_sm": 86
  },
  "kernels_list": "/opt/gpu-atlas/qualification/p15d/capture/tinyllama-prefill-bs1-ctx16-down-projection/traces/kernelslist.g",
  "qualification_record": null,
  "replay_safe": false,
  "schema_version": "hetero-trace-manifest/v1",
  "trace_id": "tinyllama.1_1b.layer0.down_projection.prefill.bs1_ctx16.fp16.sm86.accel_sim_v2",
  "trace_semantics": "functional"
}
