{
  "address_ranges": [
    {
      "alignment_bytes": 256,
      "backing_allocation_id": "tinyllama.layer0.rope.query.capture0",
      "capture_allocation_id": "tinyllama.layer0.rope.query.capture0",
      "capture_epoch": 0,
      "layout": "strided",
      "shape": [
        1,
        32,
        16,
        64
      ],
      "size_bytes": 65536,
      "tensor_id": "tinyllama.layer0.rope.query",
      "tensor_offset_bytes": 0,
      "trace_base": 47380156928,
      "view_offset_bytes": 0
    },
    {
      "alignment_bytes": 256,
      "backing_allocation_id": "tinyllama.layer0.rope.key.capture0",
      "capture_allocation_id": "tinyllama.layer0.rope.key.capture0",
      "capture_epoch": 0,
      "layout": "strided",
      "shape": [
        1,
        4,
        16,
        64
      ],
      "size_bytes": 8192,
      "tensor_id": "tinyllama.layer0.rope.key",
      "tensor_offset_bytes": 0,
      "trace_base": 47380222464,
      "view_offset_bytes": 0
    },
    {
      "alignment_bytes": 256,
      "backing_allocation_id": "tinyllama.layer0.rope.position_ids.capture0",
      "capture_allocation_id": "tinyllama.layer0.rope.position_ids.capture0",
      "capture_epoch": 0,
      "layout": "strided",
      "shape": [
        1,
        16
      ],
      "size_bytes": 128,
      "tensor_id": "tinyllama.layer0.rope.position_ids",
      "tensor_offset_bytes": 0,
      "trace_base": 47380238848,
      "view_offset_bytes": 0
    },
    {
      "alignment_bytes": 256,
      "backing_allocation_id": "tinyllama.layer0.rope.cos.capture0",
      "capture_allocation_id": "tinyllama.layer0.rope.cos.capture0",
      "capture_epoch": 0,
      "layout": "strided",
      "shape": [
        1,
        16,
        64
      ],
      "size_bytes": 2048,
      "tensor_id": "tinyllama.layer0.rope.cos",
      "tensor_offset_bytes": 0,
      "trace_base": 47380091392,
      "view_offset_bytes": 0
    },
    {
      "alignment_bytes": 256,
      "backing_allocation_id": "tinyllama.layer0.rope.sin.capture0",
      "capture_allocation_id": "tinyllama.layer0.rope.sin.capture0",
      "capture_epoch": 0,
      "layout": "strided",
      "shape": [
        1,
        16,
        64
      ],
      "size_bytes": 2048,
      "tensor_id": "tinyllama.layer0.rope.sin",
      "tensor_offset_bytes": 0,
      "trace_base": 47380093440,
      "view_offset_bytes": 0
    },
    {
      "alignment_bytes": 256,
      "backing_allocation_id": "tinyllama.layer0.rope.query_output.capture0",
      "capture_allocation_id": "tinyllama.layer0.rope.query_output.capture0",
      "capture_epoch": 0,
      "layout": "strided",
      "shape": [
        1,
        32,
        16,
        64
      ],
      "size_bytes": 65536,
      "tensor_id": "tinyllama.layer0.rope.query_output",
      "tensor_offset_bytes": 0,
      "trace_base": 47380304896,
      "view_offset_bytes": 0
    },
    {
      "alignment_bytes": 256,
      "backing_allocation_id": "tinyllama.layer0.rope.key_output.capture0",
      "capture_allocation_id": "tinyllama.layer0.rope.key_output.capture0",
      "capture_epoch": 0,
      "layout": "strided",
      "shape": [
        1,
        4,
        16,
        64
      ],
      "size_bytes": 8192,
      "tensor_id": "tinyllama.layer0.rope.key_output",
      "tensor_offset_bytes": 0,
      "trace_base": 47380095488,
      "view_offset_bytes": 0
    }
  ],
  "capture": {
    "dtype": "fp16",
    "model": "TinyLlama/TinyLlama-1.1B-Chat-v1.0",
    "model_revision": "fe8a4ea1ffedaf415f4da2f062534de366a451e6",
    "operator": "rope",
    "phase": "prefill",
    "scope": "one_shape_locked_operator_not_end_to_end",
    "shape": {
      "batch_size": 1,
      "context_length": 16,
      "kv_length": 16,
      "q_len": 16
    },
    "source": "P15 shape-locked operator capture",
    "tool": "NVBit",
    "version": "1.8"
  },
  "compilation": {
    "cuda_runtime": "12.1",
    "implementation": "transformers.LlamaRotaryEmbedding_plus_apply_rotary_pos_emb",
    "pytorch": "2.3.0+cu121",
    "target_sm": 86
  },
  "kernels_list": "/opt/gpu-atlas/qualification/p15a/tinyllama-prefill-bs1-ctx16-rope/traces/kernelslist.g",
  "qualification_record": null,
  "replay_safe": false,
  "schema_version": "hetero-trace-manifest/v1",
  "trace_id": "tinyllama.1_1b.layer0.rope.prefill.bs1_ctx16.fp16.sm86.accel_sim_v2",
  "trace_semantics": "functional"
}
