{
  "address_ranges": [
    {
      "alignment_bytes": 256,
      "backing_allocation_id": "tinyllama.decode.kv17.layer0.silu_multiply.gate.capture0",
      "capture_allocation_id": "tinyllama.decode.kv17.layer0.silu_multiply.gate.capture0",
      "capture_epoch": 0,
      "layout": "strided",
      "shape": [
        2,
        1,
        5632
      ],
      "size_bytes": 22528,
      "tensor_id": "tinyllama.decode.kv17.layer0.silu_multiply.gate",
      "tensor_offset_bytes": 0,
      "trace_base": 123241126621696,
      "view_offset_bytes": 0
    },
    {
      "alignment_bytes": 256,
      "backing_allocation_id": "tinyllama.decode.kv17.layer0.silu_multiply.up.capture0",
      "capture_allocation_id": "tinyllama.decode.kv17.layer0.silu_multiply.up.capture0",
      "capture_epoch": 0,
      "layout": "strided",
      "shape": [
        2,
        1,
        5632
      ],
      "size_bytes": 22528,
      "tensor_id": "tinyllama.decode.kv17.layer0.silu_multiply.up",
      "tensor_offset_bytes": 0,
      "trace_base": 123241126644224,
      "view_offset_bytes": 0
    },
    {
      "alignment_bytes": 256,
      "backing_allocation_id": "tinyllama.decode.kv17.layer0.silu_multiply.output.capture0",
      "capture_allocation_id": "tinyllama.decode.kv17.layer0.silu_multiply.output.capture0",
      "capture_epoch": 0,
      "layout": "strided",
      "shape": [
        2,
        1,
        5632
      ],
      "size_bytes": 22528,
      "tensor_id": "tinyllama.decode.kv17.layer0.silu_multiply.output",
      "tensor_offset_bytes": 0,
      "trace_base": 123241126689280,
      "view_offset_bytes": 0
    },
    {
      "alignment_bytes": 256,
      "backing_allocation_id": "tinyllama.layer0.silu_multiply.opaque_workspace_0.capture0",
      "capture_allocation_id": "tinyllama.layer0.silu_multiply.opaque_workspace_0.capture0",
      "capture_epoch": 0,
      "layout": "opaque_allocator_range",
      "shape": [
        1241600
      ],
      "size_bytes": 1241600,
      "tensor_id": "tinyllama.layer0.silu_multiply.opaque_workspace_0",
      "tensor_offset_bytes": 0,
      "trace_base": 123241125380096,
      "view_offset_bytes": 0
    },
    {
      "alignment_bytes": 256,
      "backing_allocation_id": "tinyllama.layer0.silu_multiply.opaque_workspace_1.capture0",
      "capture_allocation_id": "tinyllama.layer0.silu_multiply.opaque_workspace_1.capture0",
      "capture_epoch": 0,
      "layout": "opaque_allocator_range",
      "shape": [
        22528
      ],
      "size_bytes": 22528,
      "tensor_id": "tinyllama.layer0.silu_multiply.opaque_workspace_1",
      "tensor_offset_bytes": 0,
      "trace_base": 123241126666752,
      "view_offset_bytes": 0
    },
    {
      "alignment_bytes": 256,
      "backing_allocation_id": "tinyllama.layer0.silu_multiply.opaque_workspace_2.capture0",
      "capture_allocation_id": "tinyllama.layer0.silu_multiply.opaque_workspace_2.capture0",
      "capture_epoch": 0,
      "layout": "opaque_allocator_range",
      "shape": [
        765440
      ],
      "size_bytes": 765440,
      "tensor_id": "tinyllama.layer0.silu_multiply.opaque_workspace_2",
      "tensor_offset_bytes": 0,
      "trace_base": 123241126711808,
      "view_offset_bytes": 0
    }
  ],
  "capture": {
    "dtype": "fp16",
    "model": "TinyLlama/TinyLlama-1.1B-Chat-v1.0",
    "model_revision": "fe8a4ea1ffedaf415f4da2f062534de366a451e6",
    "operator": "silu_multiply",
    "phase": "decode_step",
    "scope": "one_exact_decode_shape_locked_operator_not_end_to_end",
    "shape": {
      "batch_size": 2,
      "context_length": 16,
      "kv_length": 17,
      "q_len": 1
    },
    "source": "shape-locked decode_step operator capture",
    "tool": "NVBit",
    "version": "1.8"
  },
  "compilation": {
    "binary_identity": {
      "binary_versions": [
        86
      ],
      "kernel_launch_count": 2,
      "kernel_sequence_sha256": "b96a1d338da1355a0d4d4044e25ab1e58e0037314e031e53993ad765c265e189",
      "mixed_binary_versions": false,
      "replay_compatibility": "ampere_sm80_sm86_opcode_compatible",
      "replay_target_sm": 86,
      "source": "nvbit_trace_headers"
    },
    "capture_device_sm": 89,
    "cuda_runtime": "13.2",
    "framework": "pytorch",
    "implementation": "torch.nn.functional.silu_times_up_projection",
    "launch_program": {
      "components": {
        "cuda_runtime": "13.2",
        "program_kind": "python_pytorch_launch_program",
        "python_executable": "/home/yueqi/anaconda3/envs/dl/bin/python3.12",
        "python_executable_sha256": "e0fcf110470a6ba9b0a0ad56565fb694d26319c7e356d3c92abf41c5ea9085d1",
        "python_version": "3.12.14",
        "pytorch": "2.13.0+cu132",
        "shared_operator_source": "/home/yueqi/gpu-atlas-p22-one-layer-20260907/workloads/python/tinyllama_prefill_operator.py",
        "shared_operator_source_sha256": "90de90b8bf2127c62c778f741b899cd87f3dc0fcd4dfad4994b33b5c459b3644",
        "torch_extension": "/home/yueqi/anaconda3/envs/dl/lib/python3.12/site-packages/torch/_C.cpython-312-x86_64-linux-gnu.so",
        "torch_extension_sha256": "819a187ea3b1f4d781200fe73fba3264689835d2285f7e6d10b986257a802dce",
        "transformers": "4.57.6",
        "workload_source": "/home/yueqi/gpu-atlas-p22-one-layer-20260907/workloads/python/tinyllama_decode_operator.py",
        "workload_source_sha256": "5df131dd8ebf938aefff1883639133a6c53f19debe3efae67855a172662e4259"
      },
      "kind": "python_pytorch_launch_program",
      "sha256": "7d3b3c4c0b7d7811ebc84fca81700135e173a450bdbaf7f6b2d6a9bf4ee77459"
    },
    "pytorch": "2.13.0+cu132",
    "target_sm": 86,
    "transformers": "4.57.6"
  },
  "kernels_list": "/opt/gpu-atlas/qualification/p23-bs2-decode-capture/tinyllama-decode-bs2-ctx16-kv17-silu-multiply/traces/kernelslist.g",
  "qualification_record": null,
  "replay_safe": false,
  "schema_version": "hetero-trace-manifest/v1",
  "trace_id": "tinyllama.1_1b.layer0.silu_multiply.decode_step.bs2.ctx16.q1.kv17.fp16.sm86.accel_sim_v2",
  "trace_semantics": "functional"
}
