{
  "address_ranges": [
    {
      "alignment_bytes": 256,
      "backing_allocation_id": "tinyllama.layer0.final_norm.input.capture0",
      "capture_allocation_id": "tinyllama.layer0.final_norm.input.capture0",
      "capture_epoch": 0,
      "layout": "strided",
      "shape": [
        1,
        1,
        2048
      ],
      "size_bytes": 4096,
      "tensor_id": "tinyllama.layer0.final_norm.input",
      "tensor_offset_bytes": 0,
      "trace_base": 47380156928,
      "view_offset_bytes": 0
    },
    {
      "alignment_bytes": 256,
      "backing_allocation_id": "tinyllama.layer0.final_norm.weight.capture0",
      "capture_allocation_id": "tinyllama.layer0.final_norm.weight.capture0",
      "capture_epoch": 0,
      "layout": "strided",
      "shape": [
        2048
      ],
      "size_bytes": 4096,
      "tensor_id": "tinyllama.layer0.final_norm.weight",
      "tensor_offset_bytes": 0,
      "trace_base": 47380086784,
      "view_offset_bytes": 0
    },
    {
      "alignment_bytes": 256,
      "backing_allocation_id": "tinyllama.layer0.final_norm.output.capture0",
      "capture_allocation_id": "tinyllama.layer0.final_norm.output.capture0",
      "capture_epoch": 0,
      "layout": "strided",
      "shape": [
        1,
        1,
        2048
      ],
      "size_bytes": 4096,
      "tensor_id": "tinyllama.layer0.final_norm.output",
      "tensor_offset_bytes": 0,
      "trace_base": 47380095488,
      "view_offset_bytes": 0
    },
    {
      "alignment_bytes": 256,
      "backing_allocation_id": "tinyllama.layer0.final_norm.opaque_workspace_0.capture0",
      "capture_allocation_id": "tinyllama.layer0.final_norm.opaque_workspace_0.capture0",
      "capture_epoch": 0,
      "layout": "opaque_allocator_range",
      "shape": [
        1228800
      ],
      "size_bytes": 1228800,
      "tensor_id": "tinyllama.layer0.final_norm.opaque_workspace_0",
      "tensor_offset_bytes": 0,
      "trace_base": 47378857984,
      "view_offset_bytes": 0
    },
    {
      "alignment_bytes": 256,
      "backing_allocation_id": "tinyllama.layer0.final_norm.opaque_workspace_1.capture0",
      "capture_allocation_id": "tinyllama.layer0.final_norm.opaque_workspace_1.capture0",
      "capture_epoch": 0,
      "layout": "opaque_allocator_range",
      "shape": [
        4608
      ],
      "size_bytes": 4608,
      "tensor_id": "tinyllama.layer0.final_norm.opaque_workspace_1",
      "tensor_offset_bytes": 0,
      "trace_base": 47380090880,
      "view_offset_bytes": 0
    },
    {
      "alignment_bytes": 256,
      "backing_allocation_id": "tinyllama.layer0.final_norm.opaque_workspace_2.capture0",
      "capture_allocation_id": "tinyllama.layer0.final_norm.opaque_workspace_2.capture0",
      "capture_epoch": 0,
      "layout": "opaque_allocator_range",
      "shape": [
        57344
      ],
      "size_bytes": 57344,
      "tensor_id": "tinyllama.layer0.final_norm.opaque_workspace_2",
      "tensor_offset_bytes": 0,
      "trace_base": 47380099584,
      "view_offset_bytes": 0
    },
    {
      "alignment_bytes": 256,
      "backing_allocation_id": "tinyllama.layer0.final_norm.opaque_workspace_3.capture0",
      "capture_allocation_id": "tinyllama.layer0.final_norm.opaque_workspace_3.capture0",
      "capture_epoch": 0,
      "layout": "opaque_allocator_range",
      "shape": [
        794112
      ],
      "size_bytes": 794112,
      "tensor_id": "tinyllama.layer0.final_norm.opaque_workspace_3",
      "tensor_offset_bytes": 0,
      "trace_base": 47380161024,
      "view_offset_bytes": 0
    }
  ],
  "capture": {
    "dtype": "fp16",
    "model": "TinyLlama/TinyLlama-1.1B-Chat-v1.0",
    "model_revision": "fe8a4ea1ffedaf415f4da2f062534de366a451e6",
    "operator": "final_norm",
    "phase": "prefill",
    "scope": "one_shape_locked_operator_not_end_to_end",
    "shape": {
      "batch_size": 1,
      "context_length": 16,
      "kv_length": 16,
      "q_len": 1
    },
    "source": "P15 shape-locked operator capture",
    "tool": "NVBit",
    "version": "1.8"
  },
  "compilation": {
    "cuda_runtime": "12.1",
    "implementation": "transformers.LlamaRMSNorm.final_position_only",
    "pytorch": "2.3.0+cu121",
    "target_sm": 86
  },
  "kernels_list": "/opt/gpu-atlas/qualification/p15h-address-capture/tinyllama-prefill-bs1-ctx16-final-norm/traces/kernelslist.g",
  "qualification_record": null,
  "replay_safe": false,
  "schema_version": "hetero-trace-manifest/v1",
  "trace_id": "tinyllama.1_1b.layer0.final_norm.prefill.bs1_ctx16.fp16.sm86.accel_sim_v2",
  "trace_semantics": "functional"
}
