{
  "address_ranges": [
    {
      "alignment_bytes": 256,
      "backing_allocation_id": "tinyllama.decode.kv17.layer0.token_embedding.token_ids.capture0",
      "capture_allocation_id": "tinyllama.decode.kv17.layer0.token_embedding.token_ids.capture0",
      "capture_epoch": 0,
      "layout": "strided",
      "shape": [
        2,
        1
      ],
      "size_bytes": 32,
      "tensor_id": "tinyllama.decode.kv17.layer0.token_embedding.token_ids",
      "tensor_offset_bytes": 0,
      "trace_base": 137010419335168,
      "view_offset_bytes": 0
    },
    {
      "alignment_bytes": 256,
      "backing_allocation_id": "tinyllama.decode.kv17.layer0.token_embedding.weight.capture0",
      "capture_allocation_id": "tinyllama.decode.kv17.layer0.token_embedding.weight.capture0",
      "capture_epoch": 0,
      "layout": "strided",
      "shape": [
        32000,
        2048
      ],
      "size_bytes": 131072000,
      "tensor_id": "tinyllama.decode.kv17.layer0.token_embedding.weight",
      "tensor_offset_bytes": 0,
      "trace_base": 137010564038656,
      "view_offset_bytes": 0
    },
    {
      "alignment_bytes": 256,
      "backing_allocation_id": "tinyllama.decode.kv17.layer0.token_embedding.output.capture0",
      "capture_allocation_id": "tinyllama.decode.kv17.layer0.token_embedding.output.capture0",
      "capture_epoch": 0,
      "layout": "strided",
      "shape": [
        2,
        1,
        2048
      ],
      "size_bytes": 8192,
      "tensor_id": "tinyllama.decode.kv17.layer0.token_embedding.output",
      "tensor_offset_bytes": 0,
      "trace_base": 137010419335680,
      "view_offset_bytes": 0
    },
    {
      "alignment_bytes": 32,
      "backing_allocation_id": "tinyllama.layer0.token_embedding.opaque_workspace_0.capture0",
      "capture_allocation_id": "tinyllama.layer0.token_embedding.opaque_workspace_0.capture0",
      "capture_epoch": 0,
      "layout": "opaque_allocator_range",
      "shape": [
        480
      ],
      "size_bytes": 480,
      "tensor_id": "tinyllama.layer0.token_embedding.opaque_workspace_0",
      "tensor_offset_bytes": 0,
      "trace_base": 137010419335200,
      "view_offset_bytes": 0
    },
    {
      "alignment_bytes": 256,
      "backing_allocation_id": "tinyllama.layer0.token_embedding.opaque_workspace_1.capture0",
      "capture_allocation_id": "tinyllama.layer0.token_embedding.opaque_workspace_1.capture0",
      "capture_epoch": 0,
      "layout": "opaque_allocator_range",
      "shape": [
        2088448
      ],
      "size_bytes": 2088448,
      "tensor_id": "tinyllama.layer0.token_embedding.opaque_workspace_1",
      "tensor_offset_bytes": 0,
      "trace_base": 137010419343872,
      "view_offset_bytes": 0
    },
    {
      "alignment_bytes": 256,
      "backing_allocation_id": "tinyllama.layer0.token_embedding.opaque_workspace_2.capture0",
      "capture_allocation_id": "tinyllama.layer0.token_embedding.opaque_workspace_2.capture0",
      "capture_epoch": 0,
      "layout": "opaque_allocator_range",
      "shape": [
        1048576
      ],
      "size_bytes": 1048576,
      "tensor_id": "tinyllama.layer0.token_embedding.opaque_workspace_2",
      "tensor_offset_bytes": 0,
      "trace_base": 137010695110656,
      "view_offset_bytes": 0
    }
  ],
  "capture": {
    "dtype": "fp16",
    "model": "TinyLlama/TinyLlama-1.1B-Chat-v1.0",
    "model_revision": "fe8a4ea1ffedaf415f4da2f062534de366a451e6",
    "operator": "token_embedding",
    "phase": "decode_step",
    "scope": "one_exact_decode_shape_locked_operator_not_end_to_end",
    "shape": {
      "batch_size": 2,
      "context_length": 16,
      "kv_length": 17,
      "q_len": 1
    },
    "source": "shape-locked decode_step operator capture",
    "tool": "NVBit",
    "version": "1.8"
  },
  "compilation": {
    "binary_identity": {
      "binary_versions": [
        86
      ],
      "kernel_launch_count": 1,
      "kernel_sequence_sha256": "3dc56fafb17c1373ea44bea7b9525215554314074a4eeca1628f0556010d4352",
      "source": "nvbit_trace_headers"
    },
    "capture_device_sm": 89,
    "cuda_runtime": "13.2",
    "framework": "pytorch",
    "implementation": "safetensors_exact_checkpoint_embedding_gather",
    "launch_program": {
      "components": {
        "cuda_runtime": "13.2",
        "program_kind": "python_pytorch_launch_program",
        "python_executable": "/home/yueqi/anaconda3/envs/dl/bin/python3.12",
        "python_executable_sha256": "e0fcf110470a6ba9b0a0ad56565fb694d26319c7e356d3c92abf41c5ea9085d1",
        "python_version": "3.12.14",
        "pytorch": "2.13.0+cu132",
        "shared_operator_source": "/home/yueqi/gpu-atlas-p22-one-layer-20260907/workloads/python/tinyllama_prefill_operator.py",
        "shared_operator_source_sha256": "90de90b8bf2127c62c778f741b899cd87f3dc0fcd4dfad4994b33b5c459b3644",
        "torch_extension": "/home/yueqi/anaconda3/envs/dl/lib/python3.12/site-packages/torch/_C.cpython-312-x86_64-linux-gnu.so",
        "torch_extension_sha256": "819a187ea3b1f4d781200fe73fba3264689835d2285f7e6d10b986257a802dce",
        "transformers": "4.57.6",
        "workload_source": "/home/yueqi/gpu-atlas-p22-one-layer-20260907/workloads/python/tinyllama_decode_operator.py",
        "workload_source_sha256": "5df131dd8ebf938aefff1883639133a6c53f19debe3efae67855a172662e4259"
      },
      "kind": "python_pytorch_launch_program",
      "sha256": "7d3b3c4c0b7d7811ebc84fca81700135e173a450bdbaf7f6b2d6a9bf4ee77459"
    },
    "pytorch": "2.13.0+cu132",
    "target_sm": 86,
    "transformers": "4.57.6"
  },
  "kernels_list": "/opt/gpu-atlas/qualification/p23-bs2-decode-capture/tinyllama-decode-bs2-ctx16-kv17-token-embedding/traces/kernelslist.g",
  "qualification_record": null,
  "replay_safe": false,
  "schema_version": "hetero-trace-manifest/v1",
  "trace_id": "tinyllama.1_1b.layer0.token_embedding.decode_step.bs2.ctx16.q1.kv17.fp16.sm86.accel_sim_v2",
  "trace_semantics": "functional"
}
